eventId,eventName,a4r159GateCandidate,authorDecision,correctedQuando,reason,earlyGateRisk,lateGateRisk,consequenceAsGateRisk,poaLeakageRisk,requiredNextAction,futurePOAAllowed,futurePOACondition
COMAIR-5191,Comair Flight 5191,GATE_CANDIDATE_READY_FOR_AUTHOR_REVIEW,APPROVE_WITH_MINOR_EDIT,"Quando a aeronave alinhou e iniciou a decolagem na RWY 26 como se estivesse na pista autorizada RWY 22, antes da aceleracao em pista incompativel e dos impactos subsequentes, a operacao deixou de estar em trajetoria segura/defensavel.",Gate is broadly correct but should center on alignment plus takeoff initiation rather than hold-short crossing alone,MEDIUM,LOW,HIGH,LOW,APPLY_MINOR_EDIT_IN_A4R161,NO,ONLY_AFTER_CORRECTED_GATE_APPLIED_AND_AUTHOR_APPROVED
COLGAN-3407,Colgan Air Flight 3407,GATE_CANDIDATE_READY_WITH_CAUTION,REVISE_GATE,"Quando, na aproximacao final, a velocidade/margem de energia caiu abaixo da faixa operacional defensavel para a configuracao da aeronave sem correcao estabilizadora oportuna, antes da ativacao do stick shaker e da perda final de controle, a operacao deixou de estar em trajetoria segura/defensavel.",Current text is too abstract and needs explicit defensible threshold framing for energy/airspeed,MEDIUM,MEDIUM,HIGH,MEDIUM,REVISE_GATE_WORDING_IN_A4R161,NO,ONLY_AFTER_CORRECTED_GATE_APPLIED_AND_AUTHOR_APPROVED
EXECUFLIGHT-1526,Execuflight 1526,GATE_CANDIDATE_READY_WITH_CAUTION,APPROVE_WITH_MINOR_EDIT,"Quando, ja estabelecida no localizer, a aeronave permaneceu fora do perfil vertical defensavel de aproximacao e a continuidade passou a exigir uma recuperacao vertical agressiva/incompativel com uma aproximacao estabilizada antes da MDA, a operacao deixou de estar em trajetoria segura/defensavel.",Gate is plausible but wording must stress defensible-profile loss not descent rate as standalone driver,LOW,MEDIUM,HIGH,LOW,APPLY_MINOR_EDIT_IN_A4R161,NO,ONLY_AFTER_CORRECTED_GATE_APPLIED_AND_AUTHOR_APPROVED
HELIOS-522,Helios 522,GATE_CANDIDATE_READY_WITH_CAUTION,REVISE_GATE,"Quando a aeronave iniciou/continuou a subida com o sistema de pressurizacao em estado nao defensavel e, no intervalo que culmina no warning de altitude de cabine, nao houve restauracao do estado seguro antes da incapacitacao posterior, a operacao deixou de estar em trajetoria segura/defensavel.",Gate should be interval-based from unsafe pressurization state to warning marker and not warning-centric single point,HIGH,MEDIUM,HIGH,MEDIUM,REVISE_TO_INTERVAL_GATE_IN_A4R161,NO,ONLY_AFTER_CORRECTED_GATE_APPLIED_AND_AUTHOR_APPROVED
US-AIRWAYS-1549,US Airways Flight 1549,GATE_CANDIDATE_READY_WITH_CAUTION,APPROVE_GATE,"Quando a colisao com aves resultou em perda quase total de empuxo nos dois motores durante a subida inicial, antes das decisoes de retorno, alternativa ou amerissagem, a operacao deixou de estar em trajetoria segura/defensavel.",Correct negative-control onset remains technical/environmental and must not be converted to human-origin gate,LOW,LOW,HIGH,LOW,KEEP_AND_RECONFIRM_IN_A4R161,NO,ONLY_AFTER_CORRECTED_GATE_APPLIED_AND_AUTHOR_APPROVED
