event_id,event_name,primary_gap,gap_type,severity,impact_on_future_analysis,required_followup,blocking_status
C-002,Asiana Airlines Flight 214,"Earliest escape point could sit either at A/T HOLD non-detection or at 500 ft unstable gate",ESCAPE_POINT_BOUNDARY,MEDIUM,"May affect later P/O/A timing precision","Re-audit candidate point against stable-gate rule before comparative calibration",NON_BLOCKING
C-003,UPS Airlines Flight 1354,"Need a tighter reconstruction of FMC resequence failure versus late MDA continuation",SETUP_VS_EXECUTION_BOUNDARY,MEDIUM,"Could shift whether perception or action lane dominates","Re-read FMC/profile sections during human-analysis phase",NON_BLOCKING
C-007,G-WNSB Sumburgh helicopter accident,"Full official PDF is not stored in tracked source-corpus and had to be consulted externally from official locator",SOURCE_PACKAGING,MEDIUM,"Future reviewers may need repeat fetch if no normalized local extract is added later","If authorized in a later phase, normalize a tracked non-source-corpus note or locator package",NON_BLOCKING
C-020,Comair Flight 5191,"Crew cue weighting at the runway 26 hold short line is reconstructed, not interview-confirmed",COGNITIVE_RECONSTRUCTION,LOW,"Does not weaken wrong-runway sequence but limits subjective certainty","Carry explicit uncertainty note into later human-analysis pass",NON_BLOCKING
C-001,Colgan Air Flight 3407,"Escape point split between pre-stick-shaker low-speed deterioration and immediate control response after warning",ESCAPE_POINT_AMBIGUITY,HIGH,"May materially alter direct actor framing and later P/O/A timing","Run a dedicated escape-point re-audit before any reference-case calibration use",WATCH_REQUIRED
C-016,Execuflight Flight 1526,"No FDR and poor CVR quality reduce precision of exact control/speed chronology",DATA_GRANULARITY,MEDIUM,"Fine-grained second-by-second sequencing remains less certain than NTSB transport cases","Use radar-timed anchors conservatively and avoid overprecision",NON_BLOCKING
