"component","exclusion_reason","allowed_use","prohibited_use","future_action","notes"
"Daumas","methodology-only and non-factual","methodological depth reference only","fixture expected output; factual source; baseline source","retain as methodology-only","non-event source"
"2026-0001 crank event","human-applied methodology-only","human-applied reference only","automatic expected output; fixture source; baseline source","retain as human-applied reference only","input only"
"GAP-001 PF_PM separation","retained reference only","guardrail and provenance reference only","active expected output; active fixture candidate","retain archived reference","not reopened"
"GAP-002 agent_migration","not materialized","readiness reference only","expected output now; fixture now; baseline now","hold until controlled materialization is explicitly authorized","not active"
"Colgan 3407","positive fixture candidate rejected","boundary-control reasoning outside positive lane","positive expected output; positive fixture candidate","retain outside positive lane","warning-window instability remains"
"G-WNSB","hold for source and dossier expansion","future hold reference only","expected output now; first-lane fixture now","expand source and dossier before reconsideration","second-wave hold"
"Execuflight 1526","hold for source and dossier expansion","future hold reference only","expected output now; first-lane fixture now","expand source and dossier before reconsideration","second-wave hold"
"Raw Opus inputs","audit input only","audit and quarantine context only","expected output source; fixture source","retain quarantined","not authoritative alone"
"Broad scouting inputs","raw scouting only","raw scouting context only","expected output source; fixture source","retain quarantined","not authoritative alone"
