package_id,package_name,lane,purpose,primary_inputs,allowed_outputs,forbidden_outputs,promotion_allowed,requires_human_authorization,recommended_model,status
A4R197-B,Opus audit of A4R196-A and GAP-001 PF/PM,methodology_review,independent checkpoint and controlled-draft review,A4R196-A checkpoint docs plus GAP-001 J K L artifacts,review verdict package and risk notes,selectedCode releasedCode finalConclusion CLASSIFIED fixture baseline product downstream,false,true,opus,NOT_STARTED
A4R197-C,Opus gap prioritization GAP-001 to GAP-010,methodology_review,rank methodological priority and boundary exposure,A4R193-P gap matrix plus A4R195-A consolidation,gap-priority review memo and hold flags,classification promotion fixture baseline product,false,true,opus,NOT_STARTED
A4R197-D,Opus synthetic design review design-only,synthetic_design_review,audit synthetic design constraints without materialization,synthetic design packs and contracts,design-only review verdicts and lock checks,materialization fixture baseline product,false,true,opus,NOT_STARTED
A4R197-E,Opus real-event source recovery batch 1,source_recovery,assess source sufficiency and lane risks for hold events,hold matrix plus source notes,source recovery verdicts and sufficiency report,automatic ready reentry classification promotion,false,true,opus,NOT_STARTED
A4R197-F,Opus negative-control and boundary-case review,boundary_controls,assess technical and boundary controls to avoid forced human framing,negative control candidates and boundary references,boundary control review and warnings,active classification synthetic promotion,false,true,opus,NOT_STARTED
A4R197-G,Opus Daumas-methodology reconciliation review,methodology_reconciliation,review Daumas lane usage as methodology context only,A4R193-D2 Daumas reconciliation artifacts,reconciliation verdicts and methodological guardrails,daumas automatic reentry expected-value promotion,false,true,opus,NOT_STARTED
