event_name,prior_verdict_a4r197e,strategic_decision,reason,related_gap_ids,keep_or_replace,recommended_next_lane,use_as_reference_candidate,use_as_negative_control,use_as_boundary_case,use_for_synthetic_fill_decision,stop_investing_now,notes
Colgan 3407,SOURCE_RECOVERY_PARTIAL,SOURCE_RECOVERY_CANDIDATE,Strong official source but PF/PM boundary depends on GAP-010 human decision,GAP-001|GAP-010,KEEP_CONDITIONAL,SOURCE_RECOVERY_GATE,false,false,false,true,false,Keep for deeper source recovery only after boundary decision
Thebaud,SOURCE_RECOVERY_PARTIAL,SOURCE_RECOVERY_CANDIDATE,Official TSB source exists but actor-bound timeline still incomplete,GAP-001|GAP-003,KEEP_CONDITIONAL,SOURCE_RECOVERY_GATE,true,false,false,true,false,Needs PF/PM separation and sequenceRef by actor
Peasmarsh,SOURCE_RECOVERY_PARTIAL,SOURCE_RECOVERY_CANDIDATE,AAIB source exists but warning chain contaminates anchor if forced,GAP-003|GAP-008,KEEP_CONDITIONAL,SOURCE_RECOVERY_GATE,true,false,false,true,false,Must separate warning-callout chain from escape anchor
Vigo,SOURCE_STILL_INSUFFICIENT,DISCARD_OR_REPLACE,Notification-level source with insufficient primary traceability,GAP-001|GAP-003,REPLACE,PERPLEXITY_REPLACEMENT_CAMPAIGN,false,false,false,true,true,Do not spend more time without official primary report
Delta 191,NEGATIVE_CONTROL_CANDIDATE,NEGATIVE_CONTROL,Technical/environmental onset (microburst) useful as anti-forced-human control,GAP-005,KEEP_AS_CONTROL,NEGATIVE_CONTROL_LANE,false,true,false,false,false,Retain as negative control only
USAir 427,BOUNDARY_CASE_ONLY,BOUNDARY_CASE_ONLY,Rudder technical dominance useful for technical-human boundary calibration,GAP-005|GAP-008,KEEP_AS_CONTROL,BOUNDARY_CONTROL_LANE,false,false,true,false,false,Do not force human direct-actor reentry
N109W,REQUIRES_HUMAN_DECISION,HOLD,Superseded unresolved historical draft cannot be active evidence,GAP-008,KEEP_HOLD,HOLD_RECONCILIATION,false,false,false,false,true,Maintain HOLD_FOR_HUMAN_DECISION
N11NM,REQUIRES_HUMAN_DECISION,HOLD,Superseded unresolved historical draft cannot be active evidence,GAP-008,KEEP_HOLD,HOLD_RECONCILIATION,false,false,false,false,true,Maintain HOLD_FOR_HUMAN_DECISION
5N-BQJ,NEGATIVE_CONTROL_CANDIDATE,NEGATIVE_CONTROL,Offshore technical dominance (DAFCS/TRIM FAIL) useful as negative control,GAP-005,KEEP_AS_CONTROL,NEGATIVE_CONTROL_LANE,false,true,false,false,false,Preserve as technical dominance control
