itemId,downloadedFilenameLocalOnly,sourceAuthority,officialUrl,httpOrAccessStatus,fileSizeBytes,extractedTextFilenameLocalOnly,textSizeBytes,lineCount,hasReportTitle,hasReportNumberOrOccurrenceId,hasExpectedEventNameOrRegistration,extractionStatus,qualityNotes,nextAction
A4R155-01,G-WNSB_AAIB_AAR-1-2016.pdf,AAIB UK,https://assets.publishing.service.gov.uk/media/56e7eaeaed915d0379000023/AAR_1-2016_G-WNSB.pdf,HTTP_200,10074861,G-WNSB_AAIB_AAR-1-2016.txt,669192,12154,YES,YES,YES,GOOD,Full AAIB AAR extracted with strong textual body,Promote source readiness for deep review lane
A4R155-02,BS211_US-Bangla_repository_page.html + BS211_US-Bangla_secondary_mirror.pdf,Government of Nepal repository + secondary mirror,https://repository.narchives.gov.np/items/21ae6cae-de24-4950-bd29-e2353efa903d,REPOSITORY_PAGE_HTTP_200_OFFICIAL_PDF_NOT_DIRECTLY_ACCESSIBLE,388919 + 1713188,BS211_US-Bangla_repository_page.txt + BS211_US-Bangla_secondary_mirror.txt,353523 + 128757,0 + 2217,YES,YES,YES,RESTRICTED_GOVERNMENT_REPOSITORY,Official government repository confirms report metadata but not open direct official PDF download,Keep blocked for deep review until official direct-access source is obtained
A4R155-03,N8DX_NTSB_ERA17FA135_Final_Report.pdf,NTSB,https://data.ntsb.gov/carol-repgen/api/Aviation/ReportMain/GenerateNewestReport/94910/pdf,HTTP_200,842207,N8DX_NTSB_ERA17FA135_Final_Report.txt,37348,550,YES,YES,YES,GOOD,Official NTSB final report recovered and legible; docket page also captured,Promote out of journalism-only lane
A4R155-04,DELTA-191_NTSB_AAR-86-05.pdf,NTSB,https://www.ntsb.gov/investigations/AccidentReports/Reports/AAR8605.pdf,HTTP_200,9543221,DELTA-191_NTSB_AAR-86-05.txt,167,0,NO,NO,NO,OCR_REQUIRED,Extraction produced near-empty text indicating scan/OCR failure,Maintain OCR_REQUIRED and run OCR pass in next phase
A4R155-05,QF32_ATSB_AO-2010-089.pdf,ATSB FAA-hosted final report,https://www.faa.gov/sites/faa.gov/files/QantasA380_Accident_Report.pdf,HTTP_200,21149715,QF32_ATSB_AO-2010-089.txt,596137,11407,YES,YES,YES,GOOD,High-volume extraction with expected report markers,Promote to source-ready negative-control candidate
A4R155-06,QF72_ATSB_AO-2008-070_Final.pdf,ATSB,https://www.atsb.gov.au/sites/default/files/media/4053462/ao2008070.pdf,DOWNLOAD_FAILED_HTTP2_OR_TIMEOUT,0,N/A,0,0,NO,NO,NO,DOWNLOAD_FAILED,Official target confirmed but inaccessible from this environment despite retries and alternate ATSB path attempts,Retry download in A4R156 with alternate network path or manual retrieval
A4R155-07,AF66_BEA_F-HPJE_TECHNICAL_REPORT.pdf,BEA,https://bea.aero/fileadmin/uploads/tx_elyextendttnews/F-HPJE_TECHNICAL_REPORT_12.pdf,HTTP_200,18812534,AF66_BEA_F-HPJE_TECHNICAL_REPORT.txt,121634,2298,YES,YES,YES,GOOD,Official technical report extracted with clear identifier coverage,Promote to source-ready negative-control candidate
A4R155-08,TUROY_EC225_LN-OJF_NSIA_AIBN_Report.pdf,NSIA AIBN,https://www.aibn.no/Aviation/Aviation/Published-reports/2018-04?WAF_IsPreview=true&attach=1&iid=24462&pid=SHT-Report-Attachments.Native-InnerFile-File,HTTP_200,1247726,TUROY_EC225_LN-OJF_NSIA_AIBN_Report.txt,35141,571,YES,YES,YES,USABLE_WITH_CAUTION,Core identifiers present and readable but extraction should be validated against main final report attachment set,Keep as cautionary future control pending corroboration
