"risk_id","risk","applies_to","severity","author_acceptance_required","mitigation","notes"
"RAR-001","automation boundary collapse risk","Asiana 214","high","YES","keep automation warning explicit; keep 500 ft gate explicit; block automation-as-actor","future approval must retain limitation"
"RAR-002","procedure FMC MDA collapse risk","UPS 1354","high","YES","keep setup/FMC/V-S/MDA separation explicit; block CFIT-as-cause","future approval must retain limitation"
"RAR-003","synthetic-only limitation risk","GAP-004 consequence-as-cause","high","YES","keep synthetic-only label explicit; keep not-real confirmation explicit","cannot be blended with real-event evidence"
"RAR-004","control misuse risk","Delta 191; USAir 427; 5N-BQJ","high","YES","keep control-only labeling explicit; block positive-anchor reuse","control-only is the only allowed future role"
"RAR-005","expected behavior remains non-final","Comair 5191; Asiana 214; UPS 1354; GAP-004 consequence-as-cause","medium","YES","retain NON_FINAL lock and separate later candidate-only phase","approval would not finalize outputs"
"RAR-006","candidate-only phase does not equal baseline","all requested components","high","YES","retain NO_BASELINE lock and keep official fixtures untouched","future isolated candidates remain non-baseline"
"RAR-007","product/runtime leakage risk","all requested components","high","YES","keep NOT_PRODUCT and NO_DOWNSTREAM locks explicit","no product/runtime path may open"
"RAR-008","typecheck environment debt blocks later integration","repo integration scope","medium","YES","resolve environment debt before any code/runtime integration","record FAIL_LOW_TECH_DEBT_ENVIRONMENT_PRE_EXISTING or FAIL_LOW_TECH_DEBT_PRE_EXISTING when applicable"
"RAR-009","baseline remains unauthorized","repo methodology baseline","high","YES","keep baseline untouched and outside later isolated candidate-only scope","authorization request does not authorize baseline"
