"component","exclusion_status","reason","allowed_use","prohibited_use","future_action","notes"
"Colgan 3407","REJECTED_AS_POSITIVE_FIXTURE_CANDIDATE","warning-window and PF/PM instability remain unresolved for positive reference use","boundary-warning reference only","positive fixture request now; positive anchor use; baseline now","retain outside positive lane","no fixture request in A4R211-BIG"
"G-WNSB","HOLD_FOR_SOURCE_AND_DOSSIER_EXPANSION","source and dossier expansion still incomplete","future source-expansion lane only","fixture request now; baseline now; product/runtime","hold until dossier expansion is explicitly completed","not included in authorization request matrix"
"Execuflight 1526","HOLD_FOR_SOURCE_AND_DOSSIER_EXPANSION","expanded author dossier still incomplete","future dossier-expansion lane only","fixture request now; baseline now; product/runtime","hold until dossier expansion is explicitly completed","not included in authorization request matrix"
"GAP-002 agent_migration","NOT_AUTHORIZED_NOW","not materialized","methodology planning reference only","fixture request now; baseline now; product/runtime","hold until materialized in a separate authorized lane","not included in authorization request matrix"
"GAP-001 PF_PM separation","METHODOLOGY_REFERENCE_ONLY","retained guardrail reference only","methodology reference only","fixture request now; baseline now; product/runtime","retain as methodology-only reference","do not reopen as active candidate"
"Daumas","METHODOLOGY_REFERENCE_ONLY","methodology and depth reference only; not factual source","methodology and depth reference only","factual source; fixture request; baseline source; expected output source","retain as methodology-only reference","no fixture request"
"2026-0001 crank event","HUMAN_APPLIED_REFERENCE_ONLY","human-applied SERA reference only","human-applied reference only","automatic fixture; positive fixture request; baseline source","retain as human-applied-only reference","no fixture request"
"Raw Opus inputs","QUARANTINE_INPUT_ONLY","audit input only","quarantine input only","fixture request evidence alone; baseline source","keep quarantined","no fixture request"
"Broad scouting inputs","QUARANTINE_INPUT_ONLY","raw scouting only","quarantine scouting input only","authoritative corpus use; fixture request evidence alone; baseline source","keep quarantined","no fixture request"
